{
  "$schema": "https://json-schema.org/draft/2020-12/schema",
  "$id": "https://vexil.dev/release/history/baseline-tags.json",
  "version": "1.0",
  "recordKind": "historical-tag-baseline",
  "status": "ratified",
  "remote": {"name": "origin", "url": "https://github.com/vexil-lang/vexil.git", "query": "git ls-remote --tags"},
  "observedAt": "2026-07-23T13:15:47Z",
  "baselineDigest": "sha256:849049de8e752cbc037b5bb415541d339af260298c236b9384f61bd32df5b92f",
  "tags": [
    {"kind": "lightweight", "name": "v0.1.0", "peeledCommit": "c50676f99b2984f414c36036db0d0b44d5b4a355", "refTarget": "c50676f99b2984f414c36036db0d0b44d5b4a355"},
    {"annotatedTag": "2c218f893a013a1ddc93f13bb800bb75d293c927", "kind": "annotated", "name": "v0.2.0", "peeledCommit": "15e847f50b7372c7d993b343482c3a62db5d8e35", "refTarget": "2c218f893a013a1ddc93f13bb800bb75d293c927"},
    {"kind": "lightweight", "name": "vexil-codegen-go-v0.4.2", "peeledCommit": "f4324e3f9025ad44e4c65fc59d64fae831a3bb1b", "refTarget": "f4324e3f9025ad44e4c65fc59d64fae831a3bb1b"},
    {"kind": "lightweight", "name": "vexil-codegen-go-v0.4.3", "peeledCommit": "f566ea9d35f1bdde83b9b88e02f21cbbfbe01a76", "refTarget": "f566ea9d35f1bdde83b9b88e02f21cbbfbe01a76"},
    {"kind": "lightweight", "name": "vexil-codegen-rust-v0.4.2", "peeledCommit": "f4324e3f9025ad44e4c65fc59d64fae831a3bb1b", "refTarget": "f4324e3f9025ad44e4c65fc59d64fae831a3bb1b"},
    {"kind": "lightweight", "name": "vexil-codegen-rust-v0.4.3", "peeledCommit": "f566ea9d35f1bdde83b9b88e02f21cbbfbe01a76", "refTarget": "f566ea9d35f1bdde83b9b88e02f21cbbfbe01a76"},
    {"kind": "lightweight", "name": "vexil-codegen-ts-v0.4.2", "peeledCommit": "f4324e3f9025ad44e4c65fc59d64fae831a3bb1b", "refTarget": "f4324e3f9025ad44e4c65fc59d64fae831a3bb1b"},
    {"kind": "lightweight", "name": "vexil-codegen-ts-v0.4.3", "peeledCommit": "f566ea9d35f1bdde83b9b88e02f21cbbfbe01a76", "refTarget": "f566ea9d35f1bdde83b9b88e02f21cbbfbe01a76"},
    {"kind": "lightweight", "name": "vexil-lang-v0.4.2", "peeledCommit": "f4324e3f9025ad44e4c65fc59d64fae831a3bb1b", "refTarget": "f4324e3f9025ad44e4c65fc59d64fae831a3bb1b"},
    {"kind": "lightweight", "name": "vexil-lang-v0.4.3", "peeledCommit": "f566ea9d35f1bdde83b9b88e02f21cbbfbe01a76", "refTarget": "f566ea9d35f1bdde83b9b88e02f21cbbfbe01a76"},
    {"kind": "lightweight", "name": "vexil-runtime-v0.5.0", "peeledCommit": "f4324e3f9025ad44e4c65fc59d64fae831a3bb1b", "refTarget": "f4324e3f9025ad44e4c65fc59d64fae831a3bb1b"},
    {"kind": "lightweight", "name": "vexil-runtime-v0.5.1", "peeledCommit": "f566ea9d35f1bdde83b9b88e02f21cbbfbe01a76", "refTarget": "f566ea9d35f1bdde83b9b88e02f21cbbfbe01a76"},
    {"kind": "lightweight", "name": "vexil-store-v0.4.2", "peeledCommit": "f4324e3f9025ad44e4c65fc59d64fae831a3bb1b", "refTarget": "f4324e3f9025ad44e4c65fc59d64fae831a3bb1b"},
    {"kind": "lightweight", "name": "vexilc-v0.5.0", "peeledCommit": "f4324e3f9025ad44e4c65fc59d64fae831a3bb1b", "refTarget": "f4324e3f9025ad44e4c65fc59d64fae831a3bb1b"},
    {"kind": "lightweight", "name": "vexilc-v0.5.1", "peeledCommit": "f200af308988dd10064a3a579c9d4d2a87cd5d0d", "refTarget": "f200af308988dd10064a3a579c9d4d2a87cd5d0d"}
  ],
  "ratificationIds": ["history-ratification-release-steward-2026-07-23", "history-ratification-repository-administrator-2026-07-23"],
  "blocker": "The Historical Tag baseline is ratified; Manifest approval, publication, and all provider effects remain blocked by their independent continuity and external-control gates."
}
